{
  "run_id": "20260112_011000",
  "created_at": "2026-01-12T01:10:43.620763",
  "input_source": "/Users/xjp/Desktop/Survey-with-LLMs/Survey-for-survey-review-with-LLMs/AUTOSR-SDSE/workspaces/discrete_audio_tokens_more_than_a_survey/harvest/arxiv_metadata.json",
  "criteria_source": "workspace",
  "criteria_path": "/Users/xjp/Desktop/Survey-with-LLMs/Survey-for-survey-review-with-LLMs/AUTOSR-SDSE/workspaces/discrete_audio_tokens_more_than_a_survey/criteria/criteria.json",
  "outputs": [
    {
      "name": "gemini_single",
      "path": "/Users/xjp/Desktop/Survey-with-LLMs/Survey-for-survey-review-with-LLMs/AUTOSR-SDSE/docs/codex/test/outputs/20260112_011000/gemini_single.json",
      "mode": "single",
      "provider": "gemini",
      "reviewer": "JuniorMini",
      "model": "gemini-2.5-pro"
    }
  ],
  "commands": [
    {
      "provider": "gemini",
      "command": "gemini --output-format json --model gemini-2.5-pro",
      "model": "gemini-2.5-pro",
      "tool_policy": {
        "settings_path": "/Users/xjp/Desktop/Survey-with-LLMs/Survey-for-survey-review-with-LLMs/AUTOSR-SDSE/.gemini/settings.json",
        "allow_web_search": false,
        "tools_core": [],
        "tools_exclude": [
          "google_web_search"
        ],
        "modified": false
      }
    }
  ]
}